smartctl 5.40 2010-10-16 r3189 [x86_64-redhat-linux-gnu] (local build)
Copyright (C) 2002-10 by Bruce Allen, http://smartmontools.sourceforge.net

=== START OF INFORMATION SECTION ===
Model Family:     Intel X18-M/X25-M/X25-V G2 SSDs
Device Model:     INTEL SSDSA1M160G2LE
Serial Number:    CVPO034600W4160CGN
Firmware Version: 2CV102L1
User Capacity:    160,041,885,696 bytes
Device is:        In smartctl database [for details use: -P show]
ATA Version is:   7
ATA Standard is:  ATA/ATAPI-7 T13 1532D revision 1
Local Time is:    Mon Jan 16 07:00:03 2012 IRKT
SMART support is: Available - device has SMART capability.
SMART support is: Enabled

=== START OF READ SMART DATA SECTION ===
SMART overall-health self-assessment test result: PASSED

General SMART Values:
Offline data collection status:  (0x00)	Offline data collection activity
					was never started.
					Auto Offline Data Collection: Disabled.
Self-test execution status:      (   0)	The previous self-test routine completed
					without error or no self-test has ever 
					been run.
Total time to complete Offline 
data collection: 		 (   1) seconds.
Offline data collection
capabilities: 			 (0x71) SMART execute Offline immediate.
					No Auto Offline data collection support.
					Suspend Offline collection upon new
					command.
					No Offline surface scan supported.
					Self-test supported.
					Conveyance Self-test supported.
					Selective Self-test supported.
SMART capabilities:            (0x0003)	Saves SMART data before entering
					power-saving mode.
					Supports SMART auto save timer.
Error logging capability:        (0x01)	Error logging supported.
					General Purpose Logging supported.
Short self-test routine 
recommended polling time: 	 (   1) minutes.
Extended self-test routine
recommended polling time: 	 (   1) minutes.
Conveyance self-test routine
recommended polling time: 	 (   1) minutes.

SMART Attributes Data Structure revision number: 5
Vendor Specific SMART Attributes with Thresholds:
ID# ATTRIBUTE_NAME          FLAG     VALUE WORST THRESH TYPE      UPDATED  WHEN_FAILED RAW_VALUE
  3 Spin_Up_Time            0x0020   100   100   000    Old_age   Offline      -       0
  4 Start_Stop_Count        0x0030   100   100   000    Old_age   Offline      -       0
  5 Reallocated_Sector_Ct   0x0032   100   100   000    Old_age   Always       -       2
  9 Power_On_Hours          0x0032   100   100   000    Old_age   Always       -       6544
 12 Power_Cycle_Count       0x0032   100   100   000    Old_age   Always       -       991
192 Unsafe_Shutdown_Count   0x0032   100   100   000    Old_age   Always       -       62
225 Host_Writes_32MiB       0x0030   100   100   000    Old_age   Offline      -       230097
226 Workld_Media_Wear_Indic 0x0032   100   100   000    Old_age   Always       -       10190
227 Workld_Host_Reads_Perc  0x0032   100   100   000    Old_age   Always       -       1
228 Workload_Minutes        0x0032   100   100   000    Old_age   Always       -       3426339330
232 Available_Reservd_Space 0x0033   100   100   010    Pre-fail  Always       -       0
233 Media_Wearout_Indicator 0x0032   099   099   000    Old_age   Always       -       0
184 End-to-End_Error        0x0033   100   100   090    Pre-fail  Always       -       0

SMART Error Log Version: 1
No Errors Logged

SMART Self-test log structure revision number 1
Num  Test_Description    Status                  Remaining  LifeTime(hours)  LBA_of_first_error
# 1  Vendor (0x70)       Completed without error       00%       982         -
# 2  Vendor (0xb8)       Completed without error       00%       982         -

Note: selective self-test log revision number (0) not 1 implies that no selective self-test has ever been run
SMART Selective self-test log data structure revision number 0
Note: revision number not 1 implies that no selective self-test has ever been run
 SPAN  MIN_LBA  MAX_LBA  CURRENT_TEST_STATUS
    1        0        0  Not_testing
    2        0        0  Not_testing
    3        0        0  Not_testing
    4        0        0  Not_testing
    5        0        0  Not_testing
Selective self-test flags (0x0):
  After scanning selected spans, do NOT read-scan remainder of disk.
If Selective self-test is pending on power-up, resume after 0 minute delay.

