Sat May  4 21:00:01 IRKT 2013
smartctl 6.1 2013-03-16 r3800 [x86_64-linux-3.8.11-1-ARCH] (local build)
Copyright (C) 2002-13, Bruce Allen, Christian Franke, www.smartmontools.org

=== START OF INFORMATION SECTION ===
Model Family:     Intel X18-M/X25-M/X25-V G2 SSDs
Device Model:     INTEL SSDSA1M160G2LE
Serial Number:    CVPO034600W4160CGN
LU WWN Device Id: 5 001517 9593bce58
Firmware Version: 2CV102L1
User Capacity:    160,041,885,696 bytes [160 GB]
Sector Size:      512 bytes logical/physical
Rotation Rate:    Solid State Device
Device is:        In smartctl database [for details use: -P show]
ATA Version is:   ATA/ATAPI-7 T13/1532D revision 1
SATA Version is:  SATA 2.6, 3.0 Gb/s
Local Time is:    Sat May  4 21:00:01 2013 IRKT
SMART support is: Available - device has SMART capability.
SMART support is: Enabled

=== START OF READ SMART DATA SECTION ===
SMART overall-health self-assessment test result: PASSED

General SMART Values:
Offline data collection status:  (0x02)	Offline data collection activity
					was completed without error.
					Auto Offline Data Collection: Disabled.
Self-test execution status:      (   0)	The previous self-test routine completed
					without error or no self-test has ever 
					been run.
Total time to complete Offline 
data collection: 		(    1) seconds.
Offline data collection
capabilities: 			 (0x71) SMART execute Offline immediate.
					No Auto Offline data collection support.
					Suspend Offline collection upon new
					command.
					No Offline surface scan supported.
					Self-test supported.
					Conveyance Self-test supported.
					Selective Self-test supported.
SMART capabilities:            (0x0003)	Saves SMART data before entering
					power-saving mode.
					Supports SMART auto save timer.
Error logging capability:        (0x01)	Error logging supported.
					General Purpose Logging supported.
Short self-test routine 
recommended polling time: 	 (   1) minutes.
Extended self-test routine
recommended polling time: 	 (   1) minutes.
Conveyance self-test routine
recommended polling time: 	 (   1) minutes.

SMART Attributes Data Structure revision number: 5
Vendor Specific SMART Attributes with Thresholds:
ID# ATTRIBUTE_NAME          FLAG     VALUE WORST THRESH TYPE      UPDATED  WHEN_FAILED RAW_VALUE
  3 Spin_Up_Time            0x0020   100   100   000    Old_age   Offline      -       0
  4 Start_Stop_Count        0x0030   100   100   000    Old_age   Offline      -       0
  5 Reallocated_Sector_Ct   0x0032   100   100   000    Old_age   Always       -       4
  9 Power_On_Hours          0x0032   100   100   000    Old_age   Always       -       15371
 12 Power_Cycle_Count       0x0032   100   100   000    Old_age   Always       -       1804
192 Unsafe_Shutdown_Count   0x0032   100   100   000    Old_age   Always       -       125
225 Host_Writes_32MiB       0x0030   100   100   000    Old_age   Offline      -       596932
226 Workld_Media_Wear_Indic 0x0032   100   100   000    Old_age   Always       -       2497
227 Workld_Host_Reads_Perc  0x0032   100   100   000    Old_age   Always       -       1
228 Workload_Minutes        0x0032   100   100   000    Old_age   Always       -       3392528634
232 Available_Reservd_Space 0x0033   100   100   010    Pre-fail  Always       -       0
233 Media_Wearout_Indicator 0x0032   096   096   000    Old_age   Always       -       0
184 End-to-End_Error        0x0033   100   100   097    Pre-fail  Always       -       0

SMART Error Log Version: 1
No Errors Logged

SMART Self-test log structure revision number 1
Num  Test_Description    Status                  Remaining  LifeTime(hours)  LBA_of_first_error
# 1  Vendor (0xd6)       Completed without error       00%     15332         -
# 2  Vendor (0x46)       Completed without error       00%     15332         -
# 3  Reserved (0x36)     Completed without error       00%     15332         -
# 4  Reserved (0x1e)     Completed without error       00%     15332         -
# 5  Vendor (0x70)       Completed without error       00%       982         -
# 6  Vendor (0xb8)       Completed without error       00%       982         -

SMART Selective self-test log data structure revision number 0
Note: revision number not 1 implies that no selective self-test has ever been run
 SPAN  MIN_LBA  MAX_LBA  CURRENT_TEST_STATUS
    1        0        0  Not_testing
    2        0        0  Not_testing
    3        0        0  Not_testing
    4        0        0  Not_testing
    5        0        0  Not_testing
Selective self-test flags (0x0):
  After scanning selected spans, do NOT read-scan remainder of disk.
If Selective self-test is pending on power-up, resume after 0 minute delay.

